{
  "kind": "exam_paper",
  "format_version": "1.0.0",
  "metadata": {
    "id": "demo-2026-amc-style-01",
    "title": "示例卷：数据建模与组合计数（演示）",
    "locale": "zh-CN",
    "license_spdx": "CC-BY-SA-4.0",
    "created": "2026-05-01",
    "disciplines": ["pure_mathematics", "statistics", "computer_science"],
    "difficulty_band": "competition_regional",
    "tags": ["demo", "schema-smoke-test"],
    "generator": {
      "name": "mpg-schema-init",
      "version": "0.1.0",
      "notes_markdown": "用于校验 JSON Schema 的最小合法样例，非真实竞赛卷。"
    },
    "quality": {
      "status": "draft",
      "last_reviewed": "2026-05-01",
      "reviewer": "maintainer"
    }
  },
  "specification": {
    "requirement_doc_uri": "https://example.invalid/issues/1",
    "summary_markdown": "演示统计估计与组合计数各一题；交叉学科标签示例。"
  },
  "sections": [
    {
      "id": "sec-a",
      "title": "A 组 · 填空与计算",
      "order": 1,
      "instructions_markdown": "写出必要推导过程；数值题注明精度要求。",
      "problems": [
        {
          "id": "A1",
          "stem_markdown": "**A1.** 设总体 \\(X_1,\\dots,X_n\\) i.i.d. \\(\\mathcal{N}(\\mu, \\sigma^2)\\)，写出 \\(\\mu\\) 的无偏估计量 \\(\\hat\\mu\\) 的表达式，并说明无偏性验证的一步关键等式。",
          "question_type": "short_answer",
          "points": 8,
          "disciplines": ["statistics"],
          "topics": ["unbiased_estimator", "normal_model"],
          "answer_format_hint": "给出 \\(\\hat\\mu\\) 与 \\(E[\\hat\\mu]=\\mu\\) 的关键一步。",
          "solution": {
            "final_answer_markdown": "\\(\\hat\\mu = \\bar{X} = \\frac{1}{n}\\sum_{i=1}^n X_i\\)，且 \\(E[\\bar{X}] = \\mu\\)。",
            "steps": [
              {
                "step_id": "A1-s1",
                "title": "写出样本均值",
                "detail_markdown": "样本均值定义为 \\(\\bar{X} = \\frac{1}{n}\\sum_{i=1}^n X_i\\)。",
                "reasoning_tags": ["definition"]
              },
              {
                "step_id": "A1-s2",
                "title": "验证无偏",
                "detail_markdown": "由线性性与 i.i.d.，\\(E[\\bar{X}] = \\frac{1}{n}\\sum_{i=1}^n E[X_i] = \\frac{1}{n}\\cdot n\\mu = \\mu\\)。故 \\(\\bar{X}\\) 为 \\(\\mu\\) 的无偏估计。",
                "reasoning_tags": ["expectation_linearity", "iid"]
              }
            ],
            "verification": {
              "methods": ["algebraic_recheck"],
              "notes_markdown": "核对期望线性运算与 \\(E[X_i]=\\mu\\) 前提。"
            }
          }
        },
        {
          "id": "A2",
          "stem_markdown": "**A2.** 将 \\(n\\) 个不同小球放入 \\(k\\) 个相同盒子（允许空盒），记贝尔数对应的分拆情形——本题改为 **有序盒子且不允许空盒**，求方案数的闭式表达（用 \\(n,k\\) 表示）。",
          "question_type": "computation",
          "points": 10,
          "disciplines": ["pure_mathematics", "computer_science"],
          "topics": ["combinatorics", "surjection", "stirling"],
          "solution": {
            "final_answer_markdown": "方案数为 \\(k!\\,S(n,k)\\)，其中 \\(S(n,k)\\) 为第二类 Stirling 数；等价写 \\(\\sum_{j=0}^k (-1)^{k-j}\\binom{k}{j} j^n\\)。",
            "steps": [
              {
                "step_id": "A2-s1",
                "title": "模型化",
                "detail_markdown": "不允许空盒且盒子互不相同：先忽略「非空」得到 \\(k^n\\)，再用容斥减去至少一空盒的情形，或用 Stirling 分解：把 \\(n\\) 个有标号元素划分为 \\(k\\) 个非空无标号块（\\(S(n,k)\\)），再对块赋予 \\(k\\) 个有序盒子标签（\\(k!\\)）。",
                "reasoning_tags": ["counting", "inclusion_exclusion_or_stirling"]
              },
              {
                "step_id": "A2-s2",
                "title": "结论",
                "detail_markdown": "因此总数为 \\(k!\\,S(n,k)\\)。容斥形式给出同一多项恒等式。",
                "reasoning_tags": ["closed_form"]
              }
            ],
            "verification": {
              "methods": ["boundary_special_case", "numerical_spot_check"],
              "notes_markdown": "边界：\\(n=k=1\\) 时为 1；\\(n<k\\) 时为 0（与 \\(S(n,k)=0\\) 一致）。随机取小 \\(n,k\\) 手算对照。"
            }
          }
        }
      ]
    }
  ]
}
